"Status","Start Time","Stop Time","Duration in ms","Parent Suite","Suite","Sub Suite","Test Class","Test Method","Name","Description"
"broken","Tue May 12 13:08:58 UTC 2026","Tue May 12 13:08:58 UTC 2026","210","","Autenticación de usuario","","Error al iniciar sesión con credenciales inválidas","","Error al iniciar sesión con credenciales inválidas",""
"broken","Tue May 12 13:08:58 UTC 2026","Tue May 12 13:08:58 UTC 2026","208","","Filtrado y ordenamiento de productos","","Filtrar por categoría y ordenar por precio descendente","","Filtrar por categoría y ordenar por precio descendente",""
"broken","Tue May 12 13:08:58 UTC 2026","Tue May 12 13:08:58 UTC 2026","210","","Autenticación de usuario","","Inicio de sesión exitoso con credenciales válidas","","Inicio de sesión exitoso con credenciales válidas",""
"broken","Tue May 12 13:08:56 UTC 2026","Tue May 12 13:08:58 UTC 2026","1527","","Validación del flujo de compra","","Compra exitosa con usuario registrado","","Compra exitosa con usuario registrado",""
"broken","Tue May 12 13:08:58 UTC 2026","Tue May 12 13:08:58 UTC 2026","205","","Autenticación de usuario","","Error al iniciar sesión con credenciales inválidas","","Error al iniciar sesión con credenciales inválidas",""
